[
  {
    "ref_type": "autopay",
    "ref_id": "AP-011",
    "amount_expected": 418.75,
    "age_days": null,
    "reason": "autopay_no_deposit",
    "evidence": "authorized; never deposited",
    "confidence": "HIGH"
  },
  {
    "ref_type": "autopay",
    "ref_id": "AP-009",
    "amount_expected": 523.10,
    "age_days": null,
    "reason": "autopay_no_deposit",
    "evidence": "authorized; never deposited",
    "confidence": "HIGH"
  }
]